rank,username,name,repo_description,avatar_url,profile_url,popular_repo,language,time_period,scraped_at
1,Ovilia,Wenli Zhang,口红颜色可视化 - 为什么你的女神总缺一支口红,https://avatars.githubusercontent.com/u/779050?s=96&v=4,https://github.com/Ovilia,lipstick,javascript,weekly,2025-07-04T09:20:41.845291
2,saiyam1814,Saiyam Pathak,,https://avatars.githubusercontent.com/u/8190114?s=96&v=4,https://github.com/saiyam1814,Kubernetes-crash-course-2025,javascript,weekly,2025-07-04T09:20:41.846655
3,stalniy,Serhii Stotskyi,CASL is an isomorphic authorization JavaScript library which restricts what resources a given user is allowed to access,https://avatars.githubusercontent.com/u/1159966?s=96&v=4,https://github.com/stalniy,casl,javascript,weekly,2025-07-04T09:20:41.847388
4,tommoor,Tom Moor,Normalize and render emoji's the way your users expect.,https://avatars.githubusercontent.com/u/380914?s=96&v=4,https://github.com/tommoor,react-emoji-render,javascript,weekly,2025-07-04T09:20:41.848196
5,4ian,Florian Rival,"🎮 Open-source, cross-platform 2D/3D/multiplayer game engine designed for everyone.",https://avatars.githubusercontent.com/u/1280130?s=96&v=4,https://github.com/4ian,GDevelop,javascript,weekly,2025-07-04T09:20:41.849475
6,,atomiks,"Tooltip, popover, dropdown, and menu library",https://avatars.githubusercontent.com/u/22450188?s=96&v=4,https://github.com/atomiks,tippyjs,javascript,weekly,2025-07-04T09:20:41.850266
7,lovell,Lovell Fuller,"High performance Node.js image processing, the fastest module to resize JPEG, PNG, WebP, AVIF and TIFF images. Uses the libvips library.",https://avatars.githubusercontent.com/u/210965?s=96&v=4,https://github.com/lovell,sharp,javascript,weekly,2025-07-04T09:20:41.851009
8,alexcasalboni,Alex Casalboni,AWS Lambda Power Tuning is an open-source tool that can help you visualize and fine-tune the memory/power configuration of Lambda functio…,https://avatars.githubusercontent.com/u/2457588?s=96&v=4,https://github.com/alexcasalboni,aws-lambda-power-tuning,javascript,weekly,2025-07-04T09:20:41.851752
9,rbren,Robert Brennan,"A lightweight RSS parser, for Node and the browser",https://avatars.githubusercontent.com/u/7611973?s=96&v=4,https://github.com/rbren,rss-parser,javascript,weekly,2025-07-04T09:20:41.852530
10,heyman,Jonatan Heyman,A dedicated scratchpad for developers,https://avatars.githubusercontent.com/u/54217?s=96&v=4,https://github.com/heyman,heynote,javascript,weekly,2025-07-04T09:20:41.853933
11,peduarte,Pedro Duarte,A collection of CSS effects made with Next.js.,https://avatars.githubusercontent.com/u/372831?s=96&v=4,https://github.com/peduarte,ui-snippets,javascript,weekly,2025-07-04T09:20:41.855276
12,cpsievert,Carson Sievert,R package for web-based interactive topic model visualization.,https://avatars.githubusercontent.com/u/1365941?s=96&v=4,https://github.com/cpsievert,LDAvis,javascript,weekly,2025-07-04T09:20:41.856606
13,jasnell,James M Snell,,https://avatars.githubusercontent.com/u/439929?s=96&v=4,https://github.com/jasnell,jasnell,javascript,weekly,2025-07-04T09:20:41.857946
14,codebytere,Shelley Vohr,personal website,https://avatars.githubusercontent.com/u/2036040?s=96&v=4,https://github.com/codebytere,codebytere.github.io,javascript,weekly,2025-07-04T09:20:41.858833
15,mourner,Volodymyr Agafonkin,A tiny JavaScript library for calculating sun/moon positions and phases.,https://avatars.githubusercontent.com/u/25395?s=96&v=4,https://github.com/mourner,suncalc,javascript,weekly,2025-07-04T09:20:41.859579
16,charlesBochet,Charles Bochet,Progressive Web Application made with VueJS,https://avatars.githubusercontent.com/u/12035771?s=96&v=4,https://github.com/charlesBochet,cropchat,javascript,weekly,2025-07-04T09:20:41.860324
17,jaywcjlove,小弟调调," Now we have become very big, Different from the original idea. Collect premium software in various categories.",https://avatars.githubusercontent.com/u/1680273?s=96&v=4,https://github.com/jaywcjlove,awesome-mac,javascript,weekly,2025-07-04T09:20:41.861025
18,guybedford,Guy Bedford,Shims for new ES modules features on top of the basic modules support in browsers,https://avatars.githubusercontent.com/u/598730?s=96&v=4,https://github.com/guybedford,es-module-shims,javascript,weekly,2025-07-04T09:20:41.861759
19,lutzroeder,Lutz Roeder,"Visualizer for neural network, deep learning and machine learning models",https://avatars.githubusercontent.com/u/438516?s=96&v=4,https://github.com/lutzroeder,netron,javascript,weekly,2025-07-04T09:20:41.862680
20,Defelo,Felix Bargfeldt,Run nixpkgs-review in GitHub Actions,https://avatars.githubusercontent.com/u/41747605?s=96&v=4,https://github.com/Defelo,nixpkgs-review-gha,javascript,weekly,2025-07-04T09:20:41.863469
21,marvinhagemeister,Marvin Hagemeister,Check if the export map declared in package.json is valid,https://avatars.githubusercontent.com/u/1062408?s=96&v=4,https://github.com/marvinhagemeister,check-export-map,javascript,weekly,2025-07-04T09:20:41.864263
22,,Keyrxng,"🔥 ERC20 testnet token burner for ease of disposal. Built using Solidity, Moralis and React.",https://avatars.githubusercontent.com/u/106303466?s=96&v=4,https://github.com/Keyrxng,Testnet-wallet-drainer,javascript,weekly,2025-07-04T09:20:41.865066
23,arv,Erik Arvidsson,Polyfill of the DOM URL spec for browser environment,https://avatars.githubusercontent.com/u/45845?s=96&v=4,https://github.com/arv,DOM-URL-Polyfill,javascript,weekly,2025-07-04T09:20:41.865743
24,notwaldorf,Monica Dinculescu,📚 Translate text to ✨emoji ✨!,https://avatars.githubusercontent.com/u/1369170?s=96&v=4,https://github.com/notwaldorf,emoji-translate,javascript,weekly,2025-07-04T09:20:41.866392
25,marcoscaceres,Marcos Cáceres,Runs Mobile Safari in the iOS simulator,https://avatars.githubusercontent.com/u/870154?s=96&v=4,https://github.com/marcoscaceres,karma-ios-simulator-launcher,javascript,weekly,2025-07-04T09:20:41.867103
